[
  {
    "modulePath": "infra/modules/agent-host/container-app.bicep",
    "resourceId": "infra/modules/agent-host/container-app.bicep#acrPullRoleAssignment",
    "resourceType": "Microsoft.Authorization/roleAssignments",
    "sourceCommit": "81ba62b8af0f684be3791a9105f2cf1d4d964726",
    "sourcePath": "infra/modules/agent-host/container-app.bicep"
  },
  {
    "modulePath": "infra/modules/agent-host/container-app.bicep",
    "resourceId": "infra/modules/agent-host/container-app.bicep#agentHost",
    "resourceType": "Microsoft.App/containerApps",
    "sourceCommit": "81ba62b8af0f684be3791a9105f2cf1d4d964726",
    "sourcePath": "infra/modules/agent-host/container-app.bicep"
  },
  {
    "modulePath": "infra/modules/agent-host/container-app.bicep",
    "resourceId": "infra/modules/agent-host/container-app.bicep#agentHostIdentity",
    "resourceType": "Microsoft.ManagedIdentity/userAssignedIdentities",
    "sourceCommit": "81ba62b8af0f684be3791a9105f2cf1d4d964726",
    "sourcePath": "infra/modules/agent-host/container-app.bicep"
  },
  {
    "modulePath": "infra/modules/agent-host/container-app.bicep",
    "resourceId": "infra/modules/agent-host/container-app.bicep#managedEnvironment",
    "resourceType": "Microsoft.App/managedEnvironments",
    "sourceCommit": "81ba62b8af0f684be3791a9105f2cf1d4d964726",
    "sourcePath": "infra/modules/agent-host/container-app.bicep"
  },
  {
    "modulePath": "infra/modules/agent-host/cosmos-pe.bicep",
    "resourceId": "infra/modules/agent-host/cosmos-pe.bicep#privateDnsZoneGroup",
    "resourceType": "Microsoft.Network/privateEndpoints/privateDnsZoneGroups",
    "sourceCommit": "81ba62b8af0f684be3791a9105f2cf1d4d964726",
    "sourcePath": "infra/modules/agent-host/cosmos-pe.bicep"
  },
  {
    "modulePath": "infra/modules/agent-host/cosmos-pe.bicep",
    "resourceId": "infra/modules/agent-host/cosmos-pe.bicep#privateEndpoint",
    "resourceType": "Microsoft.Network/privateEndpoints",
    "sourceCommit": "81ba62b8af0f684be3791a9105f2cf1d4d964726",
    "sourcePath": "infra/modules/agent-host/cosmos-pe.bicep"
  },
  {
    "modulePath": "infra/modules/agent-host/cosmos.bicep",
    "resourceId": "infra/modules/agent-host/cosmos.bicep#containerResources",
    "resourceType": "Microsoft.DocumentDB/databaseAccounts/sqlDatabases/containers",
    "sourceCommit": "81ba62b8af0f684be3791a9105f2cf1d4d964726",
    "sourcePath": "infra/modules/agent-host/cosmos.bicep"
  },
  {
    "modulePath": "infra/modules/agent-host/cosmos.bicep",
    "resourceId": "infra/modules/agent-host/cosmos.bicep#cosmosAccount",
    "resourceType": "Microsoft.DocumentDB/databaseAccounts",
    "sourceCommit": "81ba62b8af0f684be3791a9105f2cf1d4d964726",
    "sourcePath": "infra/modules/agent-host/cosmos.bicep"
  },
  {
    "modulePath": "infra/modules/agent-host/cosmos.bicep",
    "resourceId": "infra/modules/agent-host/cosmos.bicep#database",
    "resourceType": "Microsoft.DocumentDB/databaseAccounts/sqlDatabases",
    "sourceCommit": "81ba62b8af0f684be3791a9105f2cf1d4d964726",
    "sourcePath": "infra/modules/agent-host/cosmos.bicep"
  },
  {
    "modulePath": "infra/modules/agent-host/main.bicep",
    "resourceId": "infra/modules/agent-host/main.bicep#agentHostCosmosDataContributor",
    "resourceType": "Microsoft.DocumentDB/databaseAccounts/sqlRoleAssignments",
    "sourceCommit": "81ba62b8af0f684be3791a9105f2cf1d4d964726",
    "sourcePath": "infra/modules/agent-host/main.bicep"
  },
  {
    "modulePath": "infra/modules/agent-host/redis.bicep",
    "resourceId": "infra/modules/agent-host/redis.bicep#redis",
    "resourceType": "Microsoft.Cache/redisEnterprise",
    "sourceCommit": "81ba62b8af0f684be3791a9105f2cf1d4d964726",
    "sourcePath": "infra/modules/agent-host/redis.bicep"
  },
  {
    "modulePath": "infra/modules/agent-host/redis.bicep",
    "resourceId": "infra/modules/agent-host/redis.bicep#redisDatabase",
    "resourceType": "Microsoft.Cache/redisEnterprise/databases",
    "sourceCommit": "81ba62b8af0f684be3791a9105f2cf1d4d964726",
    "sourcePath": "infra/modules/agent-host/redis.bicep"
  },
  {
    "modulePath": "infra/modules/agents/foundry-hosted/main.bicep",
    "resourceId": "infra/modules/agents/foundry-hosted/main.bicep#bmCopilotIdentity",
    "resourceType": "Microsoft.ManagedIdentity/userAssignedIdentities",
    "sourceCommit": "81ba62b8af0f684be3791a9105f2cf1d4d964726",
    "sourcePath": "infra/modules/agents/foundry-hosted/main.bicep"
  },
  {
    "modulePath": "infra/modules/agents/foundry-hosted/main.bicep",
    "resourceId": "infra/modules/agents/foundry-hosted/main.bicep#csaIdentity",
    "resourceType": "Microsoft.ManagedIdentity/userAssignedIdentities",
    "sourceCommit": "81ba62b8af0f684be3791a9105f2cf1d4d964726",
    "sourcePath": "infra/modules/agents/foundry-hosted/main.bicep"
  },
  {
    "modulePath": "infra/modules/agents/foundry-hosted/rbac.bicep",
    "resourceId": "infra/modules/agents/foundry-hosted/rbac.bicep#bmCopilotEventHubsReceiver",
    "resourceType": "Microsoft.Authorization/roleAssignments",
    "sourceCommit": "81ba62b8af0f684be3791a9105f2cf1d4d964726",
    "sourcePath": "infra/modules/agents/foundry-hosted/rbac.bicep"
  },
  {
    "modulePath": "infra/modules/agents/foundry-hosted/rbac.bicep",
    "resourceId": "infra/modules/agents/foundry-hosted/rbac.bicep#bmCopilotStorageReader",
    "resourceType": "Microsoft.Authorization/roleAssignments",
    "sourceCommit": "81ba62b8af0f684be3791a9105f2cf1d4d964726",
    "sourcePath": "infra/modules/agents/foundry-hosted/rbac.bicep"
  },
  {
    "modulePath": "infra/modules/agents/foundry-hosted/rbac.bicep",
    "resourceId": "infra/modules/agents/foundry-hosted/rbac.bicep#csaEventHubsReceiver",
    "resourceType": "Microsoft.Authorization/roleAssignments",
    "sourceCommit": "81ba62b8af0f684be3791a9105f2cf1d4d964726",
    "sourcePath": "infra/modules/agents/foundry-hosted/rbac.bicep"
  },
  {
    "modulePath": "infra/modules/agents/foundry-hosted/rbac.bicep",
    "resourceId": "infra/modules/agents/foundry-hosted/rbac.bicep#csaStorageReader",
    "resourceType": "Microsoft.Authorization/roleAssignments",
    "sourceCommit": "81ba62b8af0f684be3791a9105f2cf1d4d964726",
    "sourcePath": "infra/modules/agents/foundry-hosted/rbac.bicep"
  },
  {
    "modulePath": "infra/modules/ai-ml-foundation/main.bicep",
    "resourceId": "infra/modules/ai-ml-foundation/main.bicep#mlWorkspace",
    "resourceType": "Microsoft.MachineLearningServices/workspaces",
    "sourceCommit": "81ba62b8af0f684be3791a9105f2cf1d4d964726",
    "sourcePath": "infra/modules/ai-ml-foundation/main.bicep"
  },
  {
    "modulePath": "infra/modules/ai-platform/main.bicep",
    "resourceId": "infra/modules/ai-platform/main.bicep#aiServices",
    "resourceType": "Microsoft.CognitiveServices/accounts",
    "sourceCommit": "81ba62b8af0f684be3791a9105f2cf1d4d964726",
    "sourcePath": "infra/modules/ai-platform/main.bicep"
  },
  {
    "modulePath": "infra/modules/api-runtime/main.bicep",
    "resourceId": "infra/modules/api-runtime/main.bicep#apiRuntimeIdentity",
    "resourceType": "Microsoft.ManagedIdentity/userAssignedIdentities",
    "sourceCommit": "81ba62b8af0f684be3791a9105f2cf1d4d964726",
    "sourcePath": "infra/modules/api-runtime/main.bicep"
  },
  {
    "modulePath": "infra/modules/api-runtime/main.bicep",
    "resourceId": "infra/modules/api-runtime/main.bicep#containerRegistry",
    "resourceType": "Microsoft.ContainerRegistry/registries",
    "sourceCommit": "81ba62b8af0f684be3791a9105f2cf1d4d964726",
    "sourcePath": "infra/modules/api-runtime/main.bicep"
  },
  {
    "modulePath": "infra/modules/apps/hcc-app-fluent/main.bicep",
    "resourceId": "infra/modules/apps/hcc-app-fluent/main.bicep#acrPullRoleAssignment",
    "resourceType": "Microsoft.Authorization/roleAssignments",
    "sourceCommit": "81ba62b8af0f684be3791a9105f2cf1d4d964726",
    "sourcePath": "infra/modules/apps/hcc-app-fluent/main.bicep"
  },
  {
    "modulePath": "infra/modules/apps/hcc-app-fluent/main.bicep",
    "resourceId": "infra/modules/apps/hcc-app-fluent/main.bicep#appFluent",
    "resourceType": "Microsoft.App/containerApps",
    "sourceCommit": "81ba62b8af0f684be3791a9105f2cf1d4d964726",
    "sourcePath": "infra/modules/apps/hcc-app-fluent/main.bicep"
  },
  {
    "modulePath": "infra/modules/apps/hcc-app-fluent/main.bicep",
    "resourceId": "infra/modules/apps/hcc-app-fluent/main.bicep#appFluentIdentity",
    "resourceType": "Microsoft.ManagedIdentity/userAssignedIdentities",
    "sourceCommit": "81ba62b8af0f684be3791a9105f2cf1d4d964726",
    "sourcePath": "infra/modules/apps/hcc-app-fluent/main.bicep"
  },
  {
    "modulePath": "infra/modules/apps/hcc-app-fluent/main.bicep",
    "resourceId": "infra/modules/apps/hcc-app-fluent/main.bicep#managedCert",
    "resourceType": "Microsoft.App/managedEnvironments/managedCertificates",
    "sourceCommit": "81ba62b8af0f684be3791a9105f2cf1d4d964726",
    "sourcePath": "infra/modules/apps/hcc-app-fluent/main.bicep"
  },
  {
    "modulePath": "infra/modules/apps/hcc-app-fluent/main.bicep",
    "resourceId": "infra/modules/apps/hcc-app-fluent/main.bicep#managedEnvironment",
    "resourceType": "Microsoft.App/managedEnvironments",
    "sourceCommit": "81ba62b8af0f684be3791a9105f2cf1d4d964726",
    "sourcePath": "infra/modules/apps/hcc-app-fluent/main.bicep"
  },
  {
    "modulePath": "infra/modules/apps/sim-capacity/main.bicep",
    "resourceId": "infra/modules/apps/sim-capacity/main.bicep#acrPullRoleAssignment",
    "resourceType": "Microsoft.Authorization/roleAssignments",
    "sourceCommit": "81ba62b8af0f684be3791a9105f2cf1d4d964726",
    "sourcePath": "infra/modules/apps/sim-capacity/main.bicep"
  },
  {
    "modulePath": "infra/modules/apps/sim-capacity/main.bicep",
    "resourceId": "infra/modules/apps/sim-capacity/main.bicep#containerApp",
    "resourceType": "Microsoft.App/containerApps",
    "sourceCommit": "81ba62b8af0f684be3791a9105f2cf1d4d964726",
    "sourcePath": "infra/modules/apps/sim-capacity/main.bicep"
  },